{
  "cycle_id": "PROD-C04-REAL",
  "batch_scope": "2 real lines",
  "posted_count": 1,
  "ambiguous_count": 0,
  "unmatched_count": 1,
  "duplicate_block_count": 1,
  "illegal_post_count": 0,
  "evidence_complete": true,
  "operator_review_completed": true,
  "anomalies": [
    "None"
  ],
  "residual_risks": [
    "In progress"
  ]
}